{
 "created_at": "2026-10-20T10:00:00Z",
 "end_t": 60.0,
 "end_tick": 1200,
 "evaluation": {
  "comparable": true,
  "components": {
   "classification": {
    "earned": 7.41,
    "effective_weight": 22.22,
    "n": 3,
    "score": 33.3,
    "weight": 20.0
   },
   "degraded": {
    "earned": 0.0,
    "effective_weight": 0.0,
    "n": 0,
    "score": 0.0,
    "weight": 10.0
   },
   "detection": {
    "earned": 22.22,
    "effective_weight": 22.22,
    "n": 3,
    "score": 100.0,
    "weight": 20.0
   },
   "evidence": {
    "earned": 8.33,
    "effective_weight": 16.67,
    "n": 3,
    "score": 50.0,
    "weight": 15.0
   },
   "response": {
    "earned": 20.37,
    "effective_weight": 22.22,
    "n": 3,
    "score": 91.7,
    "weight": 20.0
   },
   "response_time": {
    "earned": 16.67,
    "effective_weight": 16.67,
    "n": 3,
    "score": 100.0,
    "weight": 15.0
   }
  },
  "eligible_entities": 3,
  "entities": [
   {
    "ack_t": 17.0,
    "available_t": 16.0,
    "best_response": "notify_supervisor",
    "category": "bird",
    "confidence": 60,
    "correct": false,
    "credits": {
     "classification": 0.0,
     "detection": 1.0,
     "evidence": 0.25,
     "response": 0.75,
     "response_time": 1.0
    },
    "degraded": false,
    "entity": "A01",
    "evidence_s": 0.0,
    "expected_category": "unidentified_uav",
    "findings": [
     {
      "entity": "A01",
      "event_seqs": [
       16,
       28,
       29
      ],
      "penalty": false,
      "points": 0.0,
      "reason": "Classified as Bird (biological); the object was Unidentified UAV.",
      "rule": "CLASSIFICATION"
     },
     {
      "entity": "A01",
      "event_seqs": [
       16,
       28,
       29
      ],
      "penalty": false,
      "points": 0.0,
      "reason": "Confidence handling: 0 s of identification-quality availability before classifying (3 s needed for a specific call).",
      "rule": "EVIDENCE"
     },
     {
      "entity": "A01",
      "event_seqs": [
       16,
       28,
       29
      ],
      "penalty": false,
      "points": 0.0,
      "reason": "Request additional identification gave 75% credit for this object.",
      "rule": "RESPONSE"
     }
    ],
    "model_recommendation": {
     "based_on": "rules-da-2",
     "reason_code": "P_LOW_CONFIDENCE",
     "response": "request_identification"
    },
    "responded_t": 24.0,
    "response": "request_identification",
    "significant": true,
    "tracks": [
     "T003",
     "T004"
    ]
   },
   {
    "ack_t": 13.0,
    "available_t": 12.0,
    "best_response": "log_observation",
    "category": "authorised_uav",
    "confidence": 60,
    "correct": true,
    "credits": {
     "classification": 1.0,
     "detection": 1.0,
     "evidence": 1.0,
     "response": 1.0,
     "response_time": 1.0
    },
    "degraded": false,
    "entity": "A02",
    "evidence_s": 7.0,
    "expected_category": "authorised_uav",
    "findings": [],
    "model_recommendation": {
     "based_on": "rules-da-2",
     "reason_code": "P_COOPERATIVE",
     "response": "log_observation"
    },
    "responded_t": 18.0,
    "response": "log_observation",
    "significant": false,
    "tracks": [
     "T002",
     "T005"
    ]
   },
   {
    "ack_t": 9.0,
    "available_t": 7.4,
    "best_response": "log_observation",
    "category": "unidentified_uav",
    "confidence": 60,
    "correct": false,
    "credits": {
     "classification": 0.0,
     "detection": 1.0,
     "evidence": 0.25,
     "response": 1.0,
     "response_time": 1.0
    },
    "degraded": false,
    "entity": "A03",
    "evidence_s": 0.0,
    "expected_category": "bird",
    "findings": [
     {
      "entity": "A03",
      "event_seqs": [
       5,
       11,
       12
      ],
      "penalty": false,
      "points": 0.0,
      "reason": "Classified as Unidentified UAV; the object was Bird (biological).",
      "rule": "CLASSIFICATION"
     },
     {
      "entity": "A03",
      "event_seqs": [
       5,
       11,
       12
      ],
      "penalty": false,
      "points": 0.0,
      "reason": "Confidence handling: 0 s of identification-quality availability before classifying (3 s needed for a specific call).",
      "rule": "EVIDENCE"
     }
    ],
    "model_recommendation": {
     "based_on": "rules-da-2",
     "reason_code": "P_LOW_CONFIDENCE",
     "response": "request_identification"
    },
    "responded_t": 14.0,
    "response": "request_identification",
    "significant": false,
    "tracks": [
     "T001"
    ]
   }
  ],
  "findings": [
   {
    "entity": "A01",
    "event_seqs": [
     16,
     28,
     29
    ],
    "penalty": false,
    "points": 0.0,
    "reason": "Classified as Bird (biological); the object was Unidentified UAV.",
    "rule": "CLASSIFICATION"
   },
   {
    "entity": "A01",
    "event_seqs": [
     16,
     28,
     29
    ],
    "penalty": false,
    "points": 0.0,
    "reason": "Confidence handling: 0 s of identification-quality availability before classifying (3 s needed for a specific call).",
    "rule": "EVIDENCE"
   },
   {
    "entity": "A01",
    "event_seqs": [
     16,
     28,
     29
    ],
    "penalty": false,
    "points": 0.0,
    "reason": "Request additional identification gave 75% credit for this object.",
    "rule": "RESPONSE"
   },
   {
    "entity": "A03",
    "event_seqs": [
     5,
     11,
     12
    ],
    "penalty": false,
    "points": 0.0,
    "reason": "Classified as Unidentified UAV; the object was Bird (biological).",
    "rule": "CLASSIFICATION"
   },
   {
    "entity": "A03",
    "event_seqs": [
     5,
     11,
     12
    ],
    "penalty": false,
    "points": 0.0,
    "reason": "Confidence handling: 0 s of identification-quality availability before classifying (3 s needed for a specific call).",
    "rule": "EVIDENCE"
   },
   {
    "entity": "",
    "event_seqs": [],
    "penalty": false,
    "points": 0.0,
    "reason": "No object first appeared during sensor degradation; its weight was shared across the other components.",
    "rule": "W1"
   }
  ],
  "penalty_points": 0.0,
  "rubric": "da-rubric-1",
  "score": 75.0,
  "weighted_score": 75.0
 },
 "events": [
  {
   "data": {
    "ml_active": false,
    "scenario_id": "single-rural-day",
    "seed": 26247
   },
   "seq": 1,
   "t": 0.0,
   "tick": 0,
   "type": "started"
  },
  {
   "data": {
    "track_id": "T001"
   },
   "seq": 2,
   "t": 8.0,
   "tick": 160,
   "type": "track_created"
  },
  {
   "data": {
    "track_id": "T001"
   },
   "seq": 3,
   "t": 8.35,
   "tick": 167,
   "type": "track_confirmed"
  },
  {
   "data": {
    "policy": {
     "based_on": "rules-da-2",
     "reason_code": "P_INSUFFICIENT_UAV_LIKE",
     "response": "request_identification"
    },
    "rules": {
     "category": "unknown",
     "confidence": 0.3,
     "evidence": "insufficient",
     "model": "rules-da-2",
     "rule": "R0_INSUFFICIENT"
    },
    "track_id": "T001"
   },
   "seq": 4,
   "t": 9.0,
   "tick": 180,
   "type": "model_output"
  },
  {
   "data": {
    "kind": "acknowledge",
    "members": [
     "T001"
    ],
    "track_id": "T001",
    "valid": true
   },
   "seq": 5,
   "t": 9.0,
   "tick": 180,
   "type": "action"
  },
  {
   "data": {
    "track_id": "T002"
   },
   "seq": 6,
   "t": 11.7,
   "tick": 234,
   "type": "track_created"
  },
  {
   "data": {
    "track_id": "T002"
   },
   "seq": 7,
   "t": 12.95,
   "tick": 259,
   "type": "track_confirmed"
  },
  {
   "data": {
    "policy": {
     "based_on": "rules-da-2",
     "reason_code": "P_INSUFFICIENT",
     "response": "continue_observing"
    },
    "rules": {
     "category": "unknown",
     "confidence": 0.3,
     "evidence": "insufficient",
     "model": "rules-da-2",
     "rule": "R0_INSUFFICIENT"
    },
    "track_id": "T002"
   },
   "seq": 8,
   "t": 13.0,
   "tick": 260,
   "type": "model_output"
  },
  {
   "data": {
    "kind": "acknowledge",
    "members": [
     "T002"
    ],
    "track_id": "T002",
    "valid": true
   },
   "seq": 9,
   "t": 13.0,
   "tick": 260,
   "type": "action"
  },
  {
   "data": {
    "policy": {
     "based_on": "rules-da-2",
     "reason_code": "P_LOW_CONFIDENCE",
     "response": "request_identification"
    },
    "rules": {
     "category": "unidentified_uav",
     "confidence": 0.55,
     "evidence": "fair",
     "model": "rules-da-2",
     "rule": "R7_UAV_KINEMATICS"
    },
    "track_id": "T001"
   },
   "seq": 10,
   "t": 14.0,
   "tick": 280,
   "type": "model_output"
  },
  {
   "data": {
    "category": "unidentified_uav",
    "confidence": 60,
    "kind": "classify",
    "members": [
     "T001"
    ],
    "spam": false,
    "track_id": "T001",
    "valid": true
   },
   "seq": 11,
   "t": 14.0,
   "tick": 280,
   "type": "action"
  },
  {
   "data": {
    "kind": "respond",
    "members": [
     "T001"
    ],
    "model_recommendation": {
     "based_on": "rules-da-2",
     "reason_code": "P_LOW_CONFIDENCE",
     "response": "request_identification"
    },
    "response": "request_identification",
    "track_id": "T001",
    "valid": true
   },
   "seq": 12,
   "t": 14.0,
   "tick": 280,
   "type": "action"
  },
  {
   "data": {
    "track_id": "T003"
   },
   "seq": 13,
   "t": 15.35,
   "tick": 307,
   "type": "track_created"
  },
  {
   "data": {
    "track_id": "T003"
   },
   "seq": 14,
   "t": 16.75,
   "tick": 335,
   "type": "track_confirmed"
  },
  {
   "data": {
    "policy": {
     "based_on": "rules-da-2",
     "reason_code": "P_INSUFFICIENT_UAV_LIKE",
     "response": "request_identification"
    },
    "rules": {
     "category": "unknown",
     "confidence": 0.3,
     "evidence": "insufficient",
     "model": "rules-da-2",
     "rule": "R0_INSUFFICIENT"
    },
    "track_id": "T003"
   },
   "seq": 15,
   "t": 17.0,
   "tick": 340,
   "type": "model_output"
  },
  {
   "data": {
    "kind": "acknowledge",
    "members": [
     "T003"
    ],
    "track_id": "T003",
    "valid": true
   },
   "seq": 16,
   "t": 17.0,
   "tick": 340,
   "type": "action"
  },
  {